{
  "project_id": "project-ma-demo",
  "name": "Moving Average Research",
  "project_type": "Research",
  "current_version": 1,
  "versions": [
    {
      "version": 1,
      "created_at": "2026-01-05T09:30:00Z",
      "source": "Fixture",
      "files": [
        {
          "relative_path": "strategy.py",
          "sha256": "c6fa43ee0b78de1fc37791402501c89fc41679b3727d1f75d73b35dbe399f3d1",
          "size_bytes": 42
        }
      ]
    }
  ]
}
